person,quote,together
Albert Camus,Autumn is a second spring when every leaf is a flower.,"""Autumn is a second spring when every leaf is a flower."" --Albert Camus"
Albert Camus,You will never be happy if you continue to search for what happiness consists of. You will never live if you are looking for the meaning of life.,"""You will never be happy if you continue to search for what happiness consists of. You will never live if you are looking for the meaning of life."" --Albert Camus"
Albert Camus,The only way to deal with an unfree world is to become so absolutely free that your very existence is an act of rebellion.,"""The only way to deal with an unfree world is to become so absolutely free that your very existence is an act of rebellion."" --Albert Camus"
Albert Camus,In the depth of winter I finally learned that there was in me an invincible summer.,"""In the depth of winter I finally learned that there was in me an invincible summer."" --Albert Camus"
Albert Camus,"I would rather live my life as if there is a God and die to find out there isn't, than live as if there isn't and to die to find out that there is.","""I would rather live my life as if there is a God and die to find out there isn't, than live as if there isn't and to die to find out that there is."" --Albert Camus"
Albert Camus,"The evil that is in the world almost always comes of ignorance, and good intentions may do as much harm as malevolence if they lack understanding.","""The evil that is in the world almost always comes of ignorance, and good intentions may do as much harm as malevolence if they lack understanding."" --Albert Camus"
Albert Camus,A man without ethics is a wild beast loosed upon this world.,"""A man without ethics is a wild beast loosed upon this world."" --Albert Camus"
Albert Camus,Nobody realizes that some people expend tremendous energy merely to be normal.,"""Nobody realizes that some people expend tremendous energy merely to be normal."" --Albert Camus"
Albert Camus,Real generosity toward the future lies in giving all to the present.,"""Real generosity toward the future lies in giving all to the present."" --Albert Camus"
Albert Camus,Freedom is nothing but a chance to be better.,"""Freedom is nothing but a chance to be better."" --Albert Camus"
Albert Camus,The only real progress lies in learning to be wrong all alone.,"""The only real progress lies in learning to be wrong all alone."" --Albert Camus"
Albert Camus,An intellectual is someone whose mind watches itself.,"""An intellectual is someone whose mind watches itself."" --Albert Camus"
Albert Camus,"Beauty is unbearable, drives us to despair, offering us for a minute the glimpse of an eternity that we should like to stretch out over the whole of time.","""Beauty is unbearable, drives us to despair, offering us for a minute the glimpse of an eternity that we should like to stretch out over the whole of time."" --Albert Camus"
Albert Camus,"Alas, after a certain age every man is responsible for his face.","""Alas, after a certain age every man is responsible for his face."" --Albert Camus"
Albert Camus,"We continue to shape our personality all our life. If we knew ourselves perfectly, we should die.","""We continue to shape our personality all our life. If we knew ourselves perfectly, we should die."" --Albert Camus"
Albert Camus,The struggle itself towards the heights is enough to fill a man's heart. One must imagine Sisyphus happy.,"""The struggle itself towards the heights is enough to fill a man's heart. One must imagine Sisyphus happy."" --Albert Camus"
Albert Camus,Blessed are the hearts that can bend; they shall never be broken.,"""Blessed are the hearts that can bend; they shall never be broken."" --Albert Camus"
Albert Camus,"Without culture, and the relative freedom it implies, society, even when perfect, is but a jungle. This is why any authentic creation is a gift to the future.","""Without culture, and the relative freedom it implies, society, even when perfect, is but a jungle. This is why any authentic creation is a gift to the future."" --Albert Camus"
Albert Camus,Men must live and create. Live to the point of tears.,"""Men must live and create. Live to the point of tears."" --Albert Camus"
Albert Camus,Man is the only creature that refuses to be what he is.,"""Man is the only creature that refuses to be what he is."" --Albert Camus"
Albert Camus,Nothing is more despicable than respect based on fear.,"""Nothing is more despicable than respect based on fear."" --Albert Camus"
Albert Camus,Stupidity has a knack of getting its way.,"""Stupidity has a knack of getting its way."" --Albert Camus"
Albert Camus,Those who lack the courage will always find a philosophy to justify it.,"""Those who lack the courage will always find a philosophy to justify it."" --Albert Camus"
Albert Camus,You cannot create experience. You must undergo it.,"""You cannot create experience. You must undergo it."" --Albert Camus"
Albert Camus,But what is happiness except the simple harmony between a man and the life he leads?,"""But what is happiness except the simple harmony between a man and the life he leads?"" --Albert Camus"
Albert Camus,The need to be right is the sign of a vulgar mind.,"""The need to be right is the sign of a vulgar mind."" --Albert Camus"
Albert Camus,Charm is a way of getting the answer 'Yes' without asking a clear question.,"""Charm is a way of getting the answer 'Yes' without asking a clear question."" --Albert Camus"
Albert Camus,"Without work, all life goes rotten. But when work is soulless, life stifles and dies.","""Without work, all life goes rotten. But when work is soulless, life stifles and dies."" --Albert Camus"
Albert Camus,"A man's work is nothing but this slow trek to rediscover, through the detours of art, those two or three great and simple images in whose presence his heart first opened.","""A man's work is nothing but this slow trek to rediscover, through the detours of art, those two or three great and simple images in whose presence his heart first opened."" --Albert Camus"
Albert Camus,Integrity has no need of rules.,"""Integrity has no need of rules."" --Albert Camus"
Albert Camus,"A free press can, of course, be good or bad, but, most certainly without freedom, the press will never be anything but bad.","""A free press can, of course, be good or bad, but, most certainly without freedom, the press will never be anything but bad."" --Albert Camus"
Albert Camus,"To know oneself, one should assert oneself.","""To know oneself, one should assert oneself."" --Albert Camus"
Albert Camus,To be happy we must not be too concerned with others.,"""To be happy we must not be too concerned with others."" --Albert Camus"
Albert Camus,"We always deceive ourselves twice about the people we love - first to their advantage, then to their disadvantage.","""We always deceive ourselves twice about the people we love - first to their advantage, then to their disadvantage."" --Albert Camus"
Albert Camus,A guilty conscience needs to confess. A work of art is a confession.,"""A guilty conscience needs to confess. A work of art is a confession."" --Albert Camus"
Albert Camus,It is necessary to fall in love... if only to provide an alibi for all the random despair you are going to feel anyway.,"""It is necessary to fall in love... if only to provide an alibi for all the random despair you are going to feel anyway."" --Albert Camus"
Albert Camus,The welfare of the people in particular has always been the alibi of tyrants.,"""The welfare of the people in particular has always been the alibi of tyrants."" --Albert Camus"
Albert Camus,"In order to exist, man must rebel, but rebellion must respect the limits that it discovers in itself - limits where minds meet, and in meeting, begin to exist.","""In order to exist, man must rebel, but rebellion must respect the limits that it discovers in itself - limits where minds meet, and in meeting, begin to exist."" --Albert Camus"
Albert Camus,Don't wait for the last judgment - it takes place every day.,"""Don't wait for the last judgment - it takes place every day."" --Albert Camus"
Albert Camus,"Man wants to live, but it is useless to hope that this desire will dictate all his actions.","""Man wants to live, but it is useless to hope that this desire will dictate all his actions."" --Albert Camus"
